{
  "schemaVersion": "1.0",
  "id": "main",
  "title": "Minimal Story",
  "states": [
    {
      "id": "opening",
      "content": {
        "layout": "hero",
        "blocks": [{ "type": "heading", "text": "Opening" }]
      },
      "map": {
        "enter": [{ "type": "map.focus", "target": "overview" }],
        "exit": []
      }
    }
  ]
}
